{
  "$schema": "../../../schemas/project-state.schema.json",
  "project_id": "replace-with-project-id",
  "project_name": "Replace with project name",
  "customer": "Replace with customer name",
  "implementation_phase": "discovery",
  "state_version": "0.1.0",
  "created_at": "2026-01-01T00:00:00Z",
  "updated_at": "2026-01-01T00:00:00Z",
  "current_objective_ref": null,
  "current_scope_ref": null,
  "artifact_index_ref": "project/{project_id}/artifacts/artifact-index.json",
  "latest_run_ref": null,
  "baseline_refs": [],
  "decision_refs": [],
  "active_skill_path": [],
  "status": "initialized"
}
